{
  "presetName": "Government & Public Policy",
  "presetDescription": "Pre-configured for public policy research including legislative tracking, regulatory analysis, government program evaluation, lobbying disclosure, campaign finance, and policy impact assessment. Covers federal, state/provincial, and municipal levels across North American jurisdictions.",
  "keywords": ["government", "public-policy", "legislation", "regulation", "lobbying", "campaign-finance", "policy-analysis"],
  "sourceStrategy": {
    "credibilityTiers": {
      "tier1": {
        "name": "Official Government Records",
        "sources": [
          "Federal Register (federalregister.gov — U.S. rulemaking and executive orders)",
          "Canada Gazette (gazette.gc.ca — Canadian regulations and official notices)",
          "Congressional Record (congress.gov — U.S. legislative proceedings and debates)",
          "Hansard (parlvu.parl.gc.ca — Canadian parliamentary debates)",
          "GovInfo.gov (U.S. Government Publishing Office — statutes, regulations, reports)",
          "LEGISinfo (parl.ca — Canadian federal bills and legislative history)",
          "State and provincial legislature databases (individual state/province portals)",
          "Municipal bylaw and council proceeding databases",
          "Government of Canada open data (open.canada.ca)",
          "data.gov (U.S. federal open data portal)",
          "Congressional Budget Office reports (cbo.gov)",
          "Parliamentary Budget Office reports (pbo-dpb.ca)",
          "Government Accountability Office reports (gao.gov)",
          "Office of the Auditor General of Canada reports (oag-bvg.gc.ca)"
        ]
      },
      "tier2": {
        "name": "Authoritative Research & Disclosure",
        "sources": [
          "Congressional Research Service reports (crsreports.congress.gov)",
          "Library of Parliament research publications (lop.parl.ca)",
          "Brookings Institution policy research (brookings.edu)",
          "RAND Corporation policy reports (rand.org)",
          "Urban Institute research (urban.org)",
          "Fraser Institute research (fraserinstitute.org)",
          "C.D. Howe Institute research (cdhowe.org)",
          "Institute for Research on Public Policy (irpp.org)",
          "Lobbying Disclosure Act filings (lda.senate.gov — U.S. federal)",
          "Office of the Commissioner of Lobbying Canada (lobbycanada.gc.ca)",
          "Federal Election Commission filings (fec.gov)",
          "Elections Canada financial disclosures (elections.ca)",
          "State lobbying and campaign finance registries"
        ]
      },
      "tier3": {
        "name": "Informed Policy Commentary",
        "sources": [
          "Heritage Foundation policy papers (heritage.org)",
          "Cato Institute research (cato.org)",
          "Center for American Progress reports (americanprogress.org)",
          "Canadian Centre for Policy Alternatives research (policyalternatives.ca)",
          "University public policy research centers (Kennedy School, SPP Calgary, Munk School)",
          "OECD policy briefs and governance reports (oecd.org)",
          "Policy Options (policyoptions.irpp.org)",
          "Public Administration Review (academic journal)",
          "American Political Science Review (academic journal)",
          "Journal of Policy Analysis and Management"
        ]
      },
      "tier4": {
        "name": "Policy News & Government Affairs",
        "sources": [
          "Politico (politico.com — U.S. policy and legislative coverage)",
          "The Hill (thehill.com — U.S. congressional and regulatory news)",
          "Hill Times (hilltimes.com — Canadian parliamentary coverage)",
          "iPolitics (ipolitics.ca — Canadian political and policy news)",
          "Policy newsletters and government affairs firm analyses",
          "Major newspaper coverage of legislation and regulation"
        ]
      },
      "tier5": {
        "name": "Unreliable",
        "sources": [
          "Partisan advocacy organizations without disclosed funding sources",
          "Unverified social media policy claims and political commentary",
          "Anonymous political blogs and commentary sites",
          "AI-generated policy analysis without source verification",
          "Advocacy materials presenting contested interpretations as settled law"
        ]
      }
    },
    "preferredSites": [
      "federalregister.gov",
      "gazette.gc.ca",
      "congress.gov",
      "parl.ca",
      "govinfo.gov",
      "open.canada.ca",
      "data.gov",
      "cbo.gov",
      "pbo-dpb.ca",
      "gao.gov",
      "oag-bvg.gc.ca",
      "crsreports.congress.gov",
      "lda.senate.gov",
      "fec.gov",
      "brookings.edu",
      "rand.org",
      "urban.org"
    ],
    "excludedSources": [
      "medium.com",
      "quora.com"
    ],
    "searchTemplates": [
      {
        "name": "legislative-tracking",
        "pattern": "\"{bill_name}\" OR \"{bill_number}\" {legislative_body} {session_year} site:{preferred_site}"
      },
      {
        "name": "regulatory-search",
        "pattern": "\"{agency}\" rulemaking \"{topic}\" {year} site:federalregister.gov OR site:gazette.gc.ca"
      },
      {
        "name": "lobbying-disclosure",
        "pattern": "\"{organization}\" lobbying disclosure {topic} {year} site:lda.senate.gov OR site:lobbycanada.gc.ca"
      },
      {
        "name": "budget-fiscal-impact",
        "pattern": "\"{program}\" OR \"{policy}\" cost estimate fiscal impact {year} site:cbo.gov OR site:pbo-dpb.ca"
      },
      {
        "name": "policy-research",
        "pattern": "\"{policy_topic}\" analysis {jurisdiction} {year_range} site:{preferred_site}"
      }
    ],
    "languageFilters": ["en"]
  },
  "agentPipeline": {
    "tiers": {
      "quick": {
        "agents": ["legislative-researcher"]
      },
      "standard": {
        "agents": ["legislative-researcher", "policy-analyst"]
      },
      "deep": {
        "agents": ["legislative-researcher", "policy-analyst", "stakeholder-mapper"]
      },
      "comprehensive": {
        "agents": ["legislative-researcher", "policy-analyst", "stakeholder-mapper"],
        "followUpRound": true
      }
    },
    "agents": [
      {
        "id": "legislative-researcher",
        "role": "Legislative Researcher",
        "subagentType": "general-purpose",
        "model": "sonnet",
        "specialization": "Tracks and documents legislative and regulatory activity across federal, state/provincial, and municipal jurisdictions. Retrieves primary source documents including bill texts, committee reports, Hansard/Congressional Record excerpts, regulatory filings, and official government data releases. Establishes the factual legislative record by mapping bill status, amendment history, vote tallies, and regulatory comment periods.",
        "tools": ["Read", "Write", "Edit", "Bash", "WebSearch", "WebFetch", "Glob", "Grep"]
      },
      {
        "id": "policy-analyst",
        "role": "Policy Analyst",
        "subagentType": "expert-instructor",
        "model": "sonnet",
        "specialization": "Evaluates policy design, implementation feasibility, and projected impacts using structured analytical frameworks including logic models, cost-benefit analysis, and comparative policy assessment. Distinguishes between enacted law, proposed legislation, and regulatory guidance. Identifies partisan dynamics, coalition structures, and political feasibility constraints. Draws on non-partisan research institutions, CBO/PBO scoring, and academic literature to assess policy effectiveness and unintended consequences.",
        "tools": ["Read", "Write", "Edit", "Bash", "WebSearch", "WebFetch", "Glob", "Grep"]
      },
      {
        "id": "stakeholder-mapper",
        "role": "Stakeholder Mapper",
        "subagentType": "intelligence-analyst",
        "model": "sonnet",
        "specialization": "Maps the full stakeholder ecosystem around policy issues by analyzing lobbying disclosures, campaign finance records, public consultation submissions, and organizational position statements. Identifies principal actors, their interests, influence mechanisms, and coalition alignments. Traces funding relationships between advocacy organizations, think tanks, and political campaigns. Produces structured influence maps and stakeholder matrices that reveal power dynamics and potential pressure points in the policy process.",
        "tools": ["Read", "Write", "Edit", "Bash", "WebSearch", "WebFetch", "Glob", "Grep"]
      }
    ]
  },
  "qualityFramework": {
    "confidenceScoring": {
      "HIGH": "Verified against official legislative or regulatory records (Federal Register, Canada Gazette, GovInfo, LEGISinfo, or equivalent) and corroborated by at least one government publication (CBO/PBO score, GAO/OAG report, or official government data release).",
      "MEDIUM": "Supported by a recognized non-partisan research institution (Brookings, RAND, Urban Institute, Fraser Institute, C.D. Howe) plus at least one official government source. Minor interpretive gaps identified and disclosed.",
      "LOW": "Based on a single think tank or advocacy organization source without official government corroboration. May reflect a particular ideological perspective or represent a contested interpretation of legislative intent.",
      "SPECULATIVE": "Proposed legislation not yet formally tabled, or policy impact projections derived from modeling without disclosed methodology. Includes scenario analysis and political feasibility assessments dependent on unresolved variables."
    },